,ItemNum,Question,Item,Task,Story,Question2,Correct1,Correct2,Question3,Correct3,Type
20,21,Did Terry check all of today's CVs? ,Filler,Scalar_Implicatures,"The CVs that Terry has to go through are almost always from local applicants. Today Terry needs to check whether 19 CVs are from local applicants. Terry tells you on the phone: I have now checked 19 of the 19 CVs, and given what I saw, I can tell you that all of today's CVs are from local applicants.",Did Terry say that none of today's CVs are from local applicants? ,Yes,No,Estimate (in percent) how likely it is that all 19 of the CVs are from local applicants.,,
21,22,Did Donna check all of today's letters? ,Filler,Scalar_Implicatures,"Donna, a columnist, almost always gets letters from readers about personal relationships. Today Donna needs to check whether 20 letters are about personal relationships. Donna tells you on the phone: I have now checked 20 of the 20 letters, and given what I saw, I can tell you that all of today's letters are about personal relationships.",Did Donna say that none of today's letters are about personal relationships? ,Yes,No,Estimate (in percent) how likely it is that all 20 of the letters are about personal relationships.,,
22,23,Did Mark check all of today's exams? ,Critical,Scalar_Implicatures,"Students in Mark's introductory bio class almost always pass the exam. Today Mark needs to check whether 3 students passed the exam. Mark tells you on the phone: I have now checked 2 of the 3 exams, and given what I saw, I can tell you that some of today's students passed the exam.",Did Mark say that some of today's students have passed the exam? ,No,Yes,Estimate (in percent) how likely it is that all 3 of the students passed the exam.,Over50,Partial
23,24,Did Ms. Phillips look at all of today's quizzes?,Filler,Scalar_Implicatures,"The weekly quizzes Ms. Phillips gives her class almost always have errors in them. Today Ms. Phillips needs to check whether 16 of the quizzes have errors. Ms. Phillips tells you on the phone: I have now looked at 16 of the 16 quizzes, and given what I saw, I can tell you that all of today's quizzes have errors in them.",Did Ms. Phillips say that none of today's quizzes have errors in them?,Yes,No,Estimate (in percent) how likely it is that all 16 of the quizzes have errors.,,
24,25,Did Nick check all of today's desks? ,Filler,Scalar_Implicatures,"The desks in the classrooms that Nick cleans almost always have gum stuck underneath. Today, Nick needs to check whether 18 desks have gum under them. Nick tells you on the phone: I have now checked 18 of the 18 desks, and given what I saw, I can tell you that all of today's desks have gum stuck underneath.",Did Nick say that none of today's desks have gum stuck underneath?,Yes,No,Estimate (in percent) how likely it is that all 18 of the desks have gum under them.,,
25,26,Did Sophie check all of today's dogs? ,Critical,Scalar_Implicatures,"The dogs that are brought to Sophie's veterinary office almost always have fleas. Today Sophie needs to check whether 3 dogs that were brought to her office have fleas. Sophie tells you on the phone: I have now checked 3 of the 3 dogs, and given what I saw, I can tell you that some of today's dogs have fleas.",Did Sophie say that some of today's dogs have flees? ,Yes,Yes,Estimate (in percent) how likely it is that all 3 of the dogs have fleas.,Under50,Full